<?xml version="1.0" encoding="UTF-8" standalone="no"?>
<!--
 *
 * (c) Kitodo. Key to digital objects e. V. <contact@kitodo.org>
 *
 * This file is part of the Kitodo project.
 *
 * It is licensed under GNU General Public License version 3 or later.
 *
 * For the full copyright and license information, please read the
 * GPL3-License.txt file that was distributed with this source code.
 *
-->
<ruleset xmlns="http://names.kitodo.org/ruleset/v2"
         xmlns:xsi="http://www.w3.org/2001/XMLSchema-instance"
         xsi:schemaLocation="http://names.kitodo.org/ruleset/v2 ruleset.xsd">
    <declaration>
        <division id="book">
            <label>Book</label>
        </division>
        <key id="test1">
            <label>Test 1</label>
        </key>
        <key id="test2">
            <label>Test 2</label>
        </key>
        <key id="test2options">
            <label>Test 2</label>
            <option value="opt1"/>
            <option value="opt2"/>
            <option value="opt3"/>
        </key>
    </declaration>
    <correlation>
        <restriction division="book">
            <permit key="test1" minOccurs="1"/>
            <permit key="test2" minOccurs="2"/>
            <permit key="test2options" minOccurs="2"/>
        </restriction>
    </correlation>
</ruleset>
