<?xml version="1.0" encoding="UTF-8" standalone="no"?>
<!--
 *
 * (c) Kitodo. Key to digital objects e. V. <contact@kitodo.org>
 *
 * This file is part of the Kitodo project.
 *
 * It is licensed under GNU General Public License version 3 or later.
 *
 * For the full copyright and license information, please read the
 * GPL3-License.txt file that was distributed with this source code.
 *
-->
<ruleset xmlns="http://names.kitodo.org/ruleset/v2"
         xmlns:xsi="http://www.w3.org/2001/XMLSchema-instance"
         xsi:schemaLocation="http://names.kitodo.org/ruleset/v2 ruleset.xsd">
    <declaration>
        <division id="book">
            <label>Book</label>
        </division>
        <key id="defaultString">
            <label>String (default)</label>
        </key>
        <key id="anyURI">
            <label>Any URI</label>
            <codomain type="anyURI"/>
        </key>
        <key id="boolean">
            <label>Boolean</label>
            <codomain type="boolean"/>
            <option value="on"/>
        </key>
        <key id="date">
            <label>Date</label>
            <codomain type="date"/>
        </key>
        <key id="integer">
            <label>Integer</label>
            <codomain type="integer"/>
        </key>
        <key id="namespace">
            <label>Namespace (default)</label>
            <codomain namespace="http://nowhere.example/namespace-example#"/>
        </key>
        <key id="namespaceString">
            <label>Namespace (String)</label>
            <codomain type="string" namespace="http://nowhere.example/namespace-example#"/>
        </key>
    </declaration>
</ruleset>
