<?xml version="1.0" encoding="UTF-8" standalone="no"?>
<!--
 *
 * (c) Kitodo. Key to digital objects e. V. <contact@kitodo.org>
 *
 * This file is part of the Kitodo project.
 *
 * It is licensed under GNU General Public License version 3 or later.
 *
 * For the full copyright and license information, please read the
 * GPL3-License.txt file that was distributed with this source code.
 *
-->
<!-- An example how the perhaps simplest variant of a rule set might look like.
     It has only the declaration section. With this rule set, only books
     can be described. For each book author, year, title, publisher and place
     of publication can be recorded.
-->
<ruleset xmlns="http://names.kitodo.org/ruleset/v2"
         xmlns:xsi="http://www.w3.org/2001/XMLSchema-instance"
         xsi:schemaLocation="http://names.kitodo.org/ruleset/v2 ruleset.xsd">
    <declaration>
        <division id="book">
            <label>Book</label>
            <label lang="de">Buch</label>
            <label lang="fr">Livre</label>
        </division>
        <key id="document_type" use="docType">
            <label>Document type</label>
        </key>
        <key id="publicationYear">
            <label>Publication year</label>
            <codomain type="integer"/>
        </key>
        <key id="language">
            <label>Language</label>
            <!--<codomain namespace="http://id.loc.gov/vocabulary/iso639-2/"/>-->
            <option value="de"><label>Deutsch</label></option>
            <option value="fr"><label>Franz√∂sisch</label></option>
        </key>
        <key id="titleDocMain" use="structureTreeTitle">
            <label>Main title</label>
        </key>
        <key id="publisherName">
            <label>Publisher</label>
        </key>
        <key id="placeOfPublication">
            <label>Place of publication</label>
        </key>
        <key id="person">
            <label lang="de">Person (Gruppe)</label>
            <label lang="en">Person (Group)</label>
            <key id="RoleCode">
                <label>Relationship designation (code)</label>
                <label lang="de">Beziehungskennzeichnung (Code)</label>
                <option value="pht"><label>Fotograf</label></option>
                <option value="edt"><label>Herausgeber</label></option>
                <option value="aut"><label>Verfasser</label></option>
            </key>
        </key>
    </declaration>
    <correlation>
        <restriction division="book">
            <permit key="person" minOccurs="1"/>
        </restriction>
        <restriction key="person">
            <permit key="RoleCode" minOccurs="1"/>
        </restriction>
    </correlation>
    <editing>
        <setting key="language" filterable="true"/>
    </editing>
</ruleset>
